,Unnamed: 0,sent_1,sent_2,score
2003,2003.0,physically inflate,become inflated.,4.75
2004,2004.0,"heavy radioactive metallic element, atomic number 92",a heavy toxic silvery-white radioactive metallic element; occurs in many isotopes; used for nuclear fuels and nuclear weapons.,3.0
2005,2005.0,Complain about something or say mean things    to someone.,say mean things.,3.0
2006,2006.0,"care about, be bothered by, be concerned by","be offended or bothered by; take offense with, be bothered by.",3.75
2007,2007.0,"the tallied points of a game, at a given time",a number that expresses the accomplishment of a team or an individual in a game or contest.,2.75
2008,2008.0,edit so as to block the truth; prevent distribution,"subject to political, religious, or moral censorship.",2.25
2009,2009.0,"a casual, brief meeting with someone",a casual or unexpected convergence.,2.5
2010,2010.0,an electrical connection between conductor and earth,"a connection between an electrical device and a large conducting body, such as the earth (which is taken to be at zero voltage).",4.25
2011,2011.0,an agent's act of terminating an activity or event,the act of ending something.,4.0
2012,2012.0,notable or famous persons (real or fictional),a well-known or notable person.,4.5
2013,2013.0,a person who manipulate or controls a device or machine,an agent that operates some apparatus or machine.,3.75
2014,2014.0,"find, determine the place of","determine or indicate the place, site, or limits of, as if by an instrument or by a survey.",3.25
2015,2015.0,to engage in plotting or activities of an illegal or deceitful nature,act in unison or agreement and in secret towards a deceitful or illegal purpose.,4.25
2016,2016.0,"be equivalent, have the same effect as something",be tantamount or equivalent to.,3.75
2017,2017.0,(cause to) survive,cause to move by pulling.,1.0
2018,2018.0,the money,a voluntary gift (as of money or service or ideas) made to some worthwhile cause.,1.0
2019,2019.0,a sudden emotional vocalization,a loud utterance of emotion (especially when inarticulate).,3.75
2020,2020.0,"go back, restore, revive",go back to a previous state.,4.0
2021,2021.0,settlement of people distant from their homeland,a body of people who settle far from home but maintain ties with their homeland; inhabitants remain nationals of their home state but are not literally under the home state's system of government.,2.75
2022,2022.0,(The discovery or exhibition of) factual evidence that establishes the truth of something.,a formal series of statements showing that if one thing is true something else necessarily follows from it.,3.75
2023,2023.0,"enter a realm, become involved with",cause to move; cause to be in a certain position or condition.,1.5
2024,2024.0,a project or undertaking,earnest and conscientious activity intended to do or accomplish something.,3.25
2025,2025.0,a standardized system of measurements for heaviness,a system of units used to express the weight of something.,4.0
2026,2026.0,a concern or affair,some situation or event that is thought about.,4.5
2027,2027.0,have a strong sexual attraction to,feel or have a desire for; want strongly.,2.0
2028,2028.0,"a surrogate expression, utterance for a taboo word",a blank character used to separate successive words in writing or printing.,1.5
2029,2029.0,"facility for secure storage of things, often money",a facility where things can be deposited for storage or safekeeping.,4.0
2030,2030.0,emit or cause to emit noise,make a certain noise or sound.,3.75
2031,2031.0,"make physical contact with, possibly with the effect of physically manipulating.",cause to be in brief contact with.,2.333
2032,2032.0,"find out or be informed of a new information, understand or realize","get to know or become aware of, usually accidentally.",2.5
2033,2033.0,head of a country,the chief executive of a republic.,4.5
2034,2034.0,Touch with the lips.,"touch with the lips or press the lips (against someone's mouth or other body part) as an expression of love, greeting, etc..",3.0
2035,2035.0,a natural physical force of drawing towards something,the force used in pulling.,2.75
2036,2036.0,a change which is a decrease,a gradual decrease; as of stored charge or current.,3.0
2037,2037.0,"an evaluation, an estimation of worth, a grade",a number or letter indicating quality (especially of a student's performance).,3.0
2038,2038.0,having responsibility for managing or supervising,an impetuous rush toward someone or something.,1.75
2039,2039.0,fail or suffer failure,"suffer failure, as in some enterprise.",4.0
2040,2040.0,an abundance of something,the property of copious abundance.,4.0
2041,2041.0,An authoritative text or the corresponding citation.,a short note recognizing a source of information or of a quoted passage.,3.75
2042,2042.0,An instance of visual perception.,(often followed by `of') a large number or amount or extent.,0.5
2043,2043.0,"fluctuate, move back and forth",sway to and fro.,2.5
2044,2044.0,the alleviation of distress,a change for the better.,1.5
2045,2045.0,A ceremony marking admission into a religious community.,a sacrament admitting a baptized person to full participation in the church.,2.8
2046,2046.0,a social gesture of deferential greeting,a courteous expression (by word or deed) of esteem or regard.,3.4
2047,2047.0,"move to a new location, state, or situation",cause (a computer) to execute a single command.,0.0
2048,2048.0,Change one for another,"give to, and receive from, one another.",1.6
2049,2049.0,"a full stop, as a punctuation mark",a punctuation mark (.) placed at the end of a declarative sentence to indicate a full stop or after abbreviations.,4.0
2050,2050.0,something that is craved,"something craved, especially an intravenous injection of a narcotic drug.",3.25
2051,2051.0,to grow rapidly,increase rapidly and in an uncontrolled manner.,3.5
2052,2052.0,"Speak in a high-pitched tone of voice, as          either an animal or human might.",make high-pitched sounds.,3.5
2053,2053.0,domesticated animals kept for use or profit,a special variety of domesticated animals within a species.,2.5
2054,2054.0,"a discipline, a branch of knowledge",the discipline that records and interprets past events involving human beings.,2.25
2055,2055.0,"a person who is aggressively pursued, chased",a person who is the aim of an attack (especially a victim of ridicule or exploitation) by some hostile person or influence.,3.333
2056,2056.0,personnel casualty,military personnel lost by death or capture.,2.25
2057,2057.0,escape or avoid a situation or responsibility,use cunning or deceit to escape or avoid.,3.25
2058,2058.0,"a relative loss in price, value",a loss entailed by giving up or selling something at less than its value.,4.0
2059,2059.0,a measurable or quantitative decrease,a sudden sharp decrease in some quantity.,3.75
2060,2060.0,"Change the key, pitch, tone, or volume of,    likely for aesthetic reasons.","change the key of, in music.",3.5
2061,2061.0,a written message of nonacceptance,a message refusing to accept something that is offered.,5.0
2062,2062.0,(cause to) stop speaking or bring about silence,move so that an opening or passage is obstructed; make shut.,0.5
2063,2063.0,"injure, scratch the surface",cut the surface of; wear away the surface of.,3.5
2064,2064.0,A plant structure near the top of the plant.,a fruiting structure resembling an umbrella or a cone that forms the top of a stalked fleshy fungus such as a mushroom.,2.0
2065,2065.0,a written list of particular things being offered,a list of particulars (as a playbill or bill of fare).,2.5
2066,2066.0,"a notational mark used in writing, diacritic",a diacritical mark used to indicate stress or placed above a vowel to indicate a special pronunciation.,3.5
2067,2067.0,"the state of believing in, or having confidence in, something or someone",the trait of believing in the honesty and reliability of others.,3.25
2068,2068.0,an attempt or effort to achieve a goal,an attempt to get something.,4.5
2069,2069.0,"increase in amount, extent, or intensity",go up or advance.,2.75
2070,2070.0,"clean, wash thoroughly",clean with hard rubbing.,3.25
2071,2071.0,compress out of shape or into small pieces,"become injured, broken, or distorted by pressure.",2.0
2072,2072.0,"point or direct object, weapon, or blow at something or someone","point or cause to go (blows, weapons, or objects such as photographic equipment) towards.",4.0
2073,2073.0,"employ or utilize, put into service",give or convey physically.,0.75
2074,2074.0,"Spin, wind, braid, or twist together,    perhaps as when performing lacework.",do lacework.,2.5
2075,2075.0,"a decorative container, often for holding flowers",an open jar of glass or porcelain used as an ornament or to hold flowers.,4.25
2076,2076.0,"preserve, keep in safety, use frugally",preserve with sugar.,2.0
2077,2077.0,an open motorboat used for transport,a motorboat with an open deck or a half deck.,2.25
2078,2078.0,"a process of development, increase or advancement",a process of becoming larger or longer or more numerous or more important.,2.75
2079,2079.0,Make sure of.,be careful or certain to do something; make certain of something.,3.5
2080,2080.0,supply or furnish with something needed or wanted,give something useful or necessary to.,2.25
2081,2081.0,a sharp bladed instrument for shaving off hair,edge tool used in shaving.,4.0
2082,2082.0,"learn, assimilate a body of knowledge",learn by reading books.,2.0
2083,2083.0,support; hold up; nurture or provide for,lengthen or extend in duration or space.,0.75
2084,2084.0,"keep away, prevent from happening, or not do something",refrain from doing something.,4.0
2085,2085.0,Something that provides advice.,something that provides direction or advice as to a decision or course of action.,3.5
2086,2086.0,The act of copying the actions of someone else.,a representation of a person that is exaggerated for comic effect.,2.0
2087,2087.0,a physical entity,a separate and self-contained entity.,2.5
2088,2088.0,"lessen in force, impact, or effect",make less severe or harsh.,2.5
2089,2089.0,a judgement or opinion about something,a judgment of the qualities of something or somebody.,4.0
2090,2090.0,flog or whip,beat severely with a whip or rod.,2.75
2091,2091.0,"act, form, or progress according to a plan or ideal",shape or influence; give direction to.,2.25
2092,2092.0,"Germinate, as in a plant.","produce buds, branches, or germinate.",3.5
2093,2093.0,"social sphere, scope of activity or interest",a particular environment or walk of life.,1.0
2094,2094.0,"a static vertical layout, e.g. text or numbers",a vertical array of numbers or other information.,4.5
2095,2095.0,"recognize, be familar or well-versed with",be cognizant or aware of a fact or a specific piece of information; possess knowledge or information about.,2.5
2096,2096.0,"a portrayal of someone or something, through words or behavior","any likeness of a person, in any medium.",2.5
2097,2097.0,"a device to control the rate of some activity, e.g., chemical or mechanical","any of various controls or devices for regulating or controlling fluid flow, pressure, temperature, etc..",2.75
2098,2098.0,Form an aesthetic or conceptual whole.,"cause to form a united, orderly, and aesthetically consistent whole.",3.75
2099,2099.0,"human legs, informal usage",informal terms for the leg.,4.0
2100,2100.0,goal or objective,the goal intended to be attained (and which is believed to be attainable).,3.75
2101,2101.0,"protect from heat, cold, or other detrimental conditions",place or set apart.,1.75
2102,2102.0,an allotment or percentage of something,assets belonging to or due to or contributed by an individual person or group.,0.75
2103,2103.0,something that attains victory,an event that accomplishes its intended purpose.,2.75
2104,2104.0,line up or make parallel; bring into proper adjustment,place in a line or arrange so as to be parallel or straight.,4.5
2105,2105.0,a home furnishing that is a fabric cover,bedclothes consisting of a lightweight cloth covering (an afghan or bedspread) that is casually thrown over something.,3.75
2106,2106.0,meshed frame over windows and doors,a protective covering consisting of netting; can be mounted in a frame.,3.5
2107,2107.0,a measure of the likelihood or probability of an event,a measure of how likely it is that some event will occur; a number expressing the ratio of favorable cases to the whole number of cases possible.,3.75
2108,2108.0,Anyone who judges or finds fault with something.,someone who frequently finds fault or makes harsh and unfair judgments.,4.0
2109,2109.0,"the rescue or release of someone, something",recovery or preservation from loss or danger.,2.2
2110,2110.0,"observe, perceive",observe with care or pay close attention to.,3.2
2111,2111.0,"limit, keep under control, deter, forbid",to compel or deter by or as if by threats.,2.8
2112,2112.0,"stick out, jut out, protrude",extend out or project in space.,2.8
2113,2113.0,to act as the host of,be the host of or for.,4.5
2114,2114.0,"put an end to, make invalid a process that's already begun",make invalid for use.,2.0
2115,2115.0,"enjoy, be fond of or approve","feel about or towards; consider, evaluate, or regard.",1.0
2116,2116.0,per centum,a proportion in relation to a whole (which is usually the amount per hundred).,2.75
2117,2117.0,an approximate attribute or quality of something,an approximate definition or example.,3.75
2118,2118.0,The act of having and controlling property.,the state or fact of being an owner.,4.25
2119,2119.0,"a physical protuberance, large or small",a natural elevation (especially a rocky one that juts out into the sea).,2.25
2120,2120.0,estimate or calculate the numerical value of something,"evaluate or estimate the nature, quality, ability, extent, or significance of.",3.5
2121,2121.0,a portion or percentage of a whole,the part played by a person in bringing about a result.,0.5
2122,2122.0,"lightest most abundant element, atomic number 1",a nonmetallic univalent element that is normally a colorless and odorless highly flammable diatomic gas; the simplest and lightest and most abundant element in the universe.,3.25
2123,2123.0,a unit cost of something,a single chance or instance.,0.0
2124,2124.0,move back and forth,move or sway in a rising and falling or wavelike pattern.,2.0
2125,2125.0,a cyclical span of time defined by a calendar system,a period of time containing 365 (or 366) days.,2.25
2126,2126.0,face an event and survive; endure,face and withstand with courage.,2.25
2127,2127.0,(medicine) the capacity of an organism to defend against disease.,(medicine) the condition in which an organism can resist disease.,4.0
2128,2128.0,"a statement, an idea expressed in language",a brief statement.,3.0
2129,2129.0,perform a duty,do duty or hold offices; serve in a specific function.,3.5
2130,2130.0,soldier who is a member of a special forces group,a member of a military unit trained as shock troops for hit-and-run raids.,3.25
2131,2131.0,"become master of, overcome, dominate",get on top of; deal with successfully.,4.0
2132,2132.0,"area of damaged, cut tissue on a living body",a casualty to military personnel resulting from combat.,0.5
2133,2133.0,revolve,change directions as if revolving on a pivot.,1.75
2134,2134.0,twice the quantity or amount of something,a quantity that is twice as great as another.,4.0
2135,2135.0,"Give an incentive for action, provoke or    stir up, urge on, or cause to act.",provoke or stir up.,3.25
2136,2136.0,Funeral direction,the trade of a funeral director.,3.0
2137,2137.0,to ignite or catch on fire,catch fire.,4.25
2138,2138.0,a large approximate quantity of some attribute or thing,a concentrated example of something.,2.75
2139,2139.0,Medicines,a substance that is used as a medicine or narcotic.,3.0
2140,2140.0,a method for solving a problem,the successful action of solving a problem.,3.75
2141,2141.0,"reach an objective, attain a benchmark or goal",develop in a positive way.,2.0
2142,2142.0,take something or someone away from somewhere,go away or leave.,1.6
2143,2143.0,a stiffener in a garment,(nautical) brace consisting of a heavy rope or wire cable used as a support for a mast or spar.,1.0
2144,2144.0,a constructed underground passageway,"a passageway through or under something, usually underground (especially one for trains or cars).",3.8
2145,2145.0,"discern, identify, or know because of a previous experience",be fully aware or cognizant of.,2.25
2146,2146.0,move or change one's own position or quality,move very slightly.,3.0
2147,2147.0,incorporate or enclose one thing in another,incorporate a food ingredient into a mixture by repeatedly turning it over without stirring or beating.,1.75
2148,2148.0,"guide, draw through","pass over, across, or through.",1.75
2149,2149.0,"rescue, redeem, deliver from harm or danger",refrain from harming.,3.4
2150,2150.0,beat (as if) with a whip or rod,strike as if by whipping.,4.0
2151,2151.0,the medical procedure of manually turning the uterus,manual turning of a fetus in the uterus (usually to aid delivery).,4.4
2152,2152.0,create an edge or border,enclose in or as if in a frame.,2.6
2153,2153.0,restart or continue an activity after an interruption or pause,take up or begin anew.,2.25
2154,2154.0,"capture, ensnare, discover in the act","discover or come upon accidentally, suddenly, or unexpectedly; catch somebody doing something or in a certain state.",2.75
2155,2155.0,"initiation, founding, introduction of something",the act of starting something for the first time; introducing something new.,3.25
2156,2156.0,a creased or bent form,an angular or rounded shape made by folding.,2.75
2157,2157.0,"train, tutor or polish social behavior, taste, judgement",teach or refine to be discriminative in taste or judgment.,4.5
2158,2158.0,a mental activity of construing or interpreting,an interpretation of a text or action.,3.25
2159,2159.0,emphasize; draw attention to; underline,draw a line or lines underneath to call attention to.,4.25
2160,2160.0,possibility for the future,a prediction of the course of a disease.,2.0
2161,2161.0,require or need something that is missing,have need of.,3.25
2162,2162.0,"an indication or manifestation of something, often physical",an indication of damage.,2.75
2163,2163.0,"a sudden, brief burst of light",a momentary brightness.,3.75
2164,2164.0,"come or bring back to life, health, existence or use",cause to regain consciousness.,2.25
2165,2165.0,A mental state of sadness.,a mental state characterized by a pessimistic sense of inadequacy and a despondent lack of activity.,3.25
2166,2166.0,position or location change,the act of changing the location of something.,3.75
2167,2167.0,"(cause to) move through a space, circuit or system, usu. returning to the starting point",move in circles.,3.75
2168,2168.0,bring in to consonance,bring (several things) into consonance or relate harmoniously.,3.75
2169,2169.0,"submit, send to",cause to move; cause to be in a certain position or condition.,1.5
2170,2170.0,state of being unified,the state of being joined or united or linked.,3.75
2171,2171.0,"(Cause to) become different or aquire a          different character, possibly during development.",become distinct and acquire a different character.,3.0
2172,2172.0,an objective or goal,the goal intended to be attained (and which is believed to be attainable).,3.5
2173,2173.0,seize and take captive; take or gain possession of something,"take possession of by force, as after an invasion.",3.5
2174,2174.0,"give, dedicate, pledge","give entirely to a specific person, activity, or cause.",3.25
2175,2175.0,decide a specific time for an event,make a schedule; plan the time and place for events.,4.0
2176,2176.0,value a thing or course of action more highly than another,like better; value more highly.,4.75
2177,2177.0,give something for a cause,give to a charity or good cause.,3.75
2178,2178.0,furnish with a guideline,furnish with rubrics or regulate by rubrics.,3.75
2179,2179.0,"a social entreaty, as courtship or pleading",a petition or appeal made to a person of superior status or rank.,2.5
2180,2180.0,fail in strength or health and cease to funtion,"break down, literally or metaphorically.",2.25
2181,2181.0,"reply verbally or in written form to a question, comment, letter, or speech",react verbally.,3.667
2182,2182.0,a slight cut in a physical surface,a slight surface cut (especially a notch that is made to keep a tally).,3.75
2183,2183.0,cause something to be the case,cause to move; cause to be in a certain position or condition.,3.25
2184,2184.0,a state of confinement in a small space,the act of forcing yourself (or being forced) into or through a restricted space.,4.0
2185,2185.0,state or explain the meaning,give a definition for the meaning of a word.,4.0
2186,2186.0,cause animals to move,pursue for food or sport (as of wild animals).,1.25
2187,2187.0,"be against, resist",act against or in opposition to.,4.5
2188,2188.0,a quantity of money added to a bank account,money deposited in a bank or some similar institution.,4.25
2189,2189.0,cause to come into existence; create,bring into being.,3.25
2190,2190.0,"Performance, routine",a short theatrical performance that is part of a longer program.,2.5
2191,2191.0,people assembled together in a rhythmic movement,a party of people assembled for dancing.,4.25
2192,2192.0,a computer server,(computer science) a computer that provides client stations with access to files and printers as shared resources to a computer network.,3.0
2193,2193.0,"forbid, prohibit",forbid the public distribution of ( a movie or a newspaper).,2.25
2194,2194.0,computer text files,(computer science) a computer file that contains text (and possibly formatting instructions) using seven-bit ASCII characters.,3.0
2195,2195.0,a speech act of acknowledging gratitude for something,an acknowledgment of appreciation.,2.25
2196,2196.0,"a state of pretending to be someone, something else",an outward semblance that misrepresents the true nature of something.,3.333
2197,2197.0,Become widespread as an idea or feeling.,cause to become widely known.,2.75
2198,2198.0,connect with; reach a target or goal,"perceive with the senses quickly, suddenly, or momentarily.",0.0
2199,2199.0,income collected as tax by a government,government income due to taxation.,4.75
2200,2200.0,be the deciding factor in a state of affairs or an outcome,shape or influence; give direction to.,2.0
2201,2201.0,end,put an end to.,3.0
2202,2202.0,a region allocated to hold something,the particular portion of space occupied by something.,4.5
2203,2203.0,acknowledge a contribution or cause,have trust in; trust in the truth or veracity of.,0.75
2204,2204.0,arrangement,logical or comprehensible arrangement of separate elements.,2.0
2205,2205.0,system of arrangement,an arrangement scheme.,3.75
2206,2206.0,close within bounds; deprive of freedom,"to close within bounds, limit or hold back from movement.",3.75
2207,2207.0,"to collect, acquire or gather",get or gather together.,4.75
2208,2208.0,deliver a formal talk or reprimand at length,censure severely or angrily.,0.5
2209,2209.0,"a pair of mated people, e.g., married",a pair of people who live together.,5.0
2210,2210.0,rot; become unfit for consumption,become unfit for consumption or use.,4.75
2211,2211.0,lock with one another,become engaged or intermeshed with one another.,3.25
2212,2212.0,"take vows, join or allow to join a religious order","take vows, as in religious order.",4.5
2213,2213.0,activity of selling,the general activity of selling.,4.75
2214,2214.0,"give out, allow to have",allow to have.,4.5
2215,2215.0,"secondary public school, grades 9-12",a public secondary school usually including grades 9 through 12.,4.75
2216,2216.0,"Benjamin Rush, physician and American Revolutionary leader.",physician and American Revolutionary leader; signer of the Declaration of Independence (1745-1813).,3.0
2217,2217.0,luggage compartment of a car,British term for the luggage compartment in a car.,2.5
2218,2218.0,have a monopoly of; control fully,have or exploit a monopoly of.,4.5
2219,2219.0,reduce to a simpler molecular compound,reduce (petroleum) to a simpler compound by cracking.,3.75
2220,2220.0,cause to be interested,attract; cause to be enamored.,2.5
2221,2221.0,To remain emotionally or intellectually          attached without necessary physical contact.,to remain emotionally or intellectually attached.,3.5
2222,2222.0,The act of transporting goods commerically at rates cheaper than express rates.,transporting goods commercially at rates cheaper than express rates.,4.75
2223,2223.0,(An occurance of) the preservation or management of natural resources.,the preservation and careful management of the environment and of natural resources.,4.5
2224,2224.0,"remove the pod, husk or shell",fall out of the pod or husk.,4.0
2225,2225.0,abstain from eating or from certain foods,abstain from eating.,4.0
2226,2226.0,"feel hot or painful, as if burning",feel hot or painful.,4.0
2227,2227.0,(cause to) return after being refused,come back after being refused.,4.75
2228,2228.0,a loss of function,loss of ability to function normally.,4.25
2229,2229.0,"administrator, one who controls resources",someone who controls resources and expenditures.,3.5
2230,2230.0,"a stovetop, cooking appliance",a kitchen appliance used for cooking food.,3.75
2231,2231.0,"rinse one's mouth with mouthwash, gargle",rinse one's mouth and throat with mouthwash.,4.5
2232,2232.0,a quantity that is an approximate calculation,an approximate calculation of quantity or degree or worth.,4.0
2233,2233.0,turn on an axis; spin,turn on or around an axis or a center.,4.0
2234,2234.0,marriage offer,an offer of marriage.,5.0
2235,2235.0,Try to gain favor by flattering or showing    submission or fear.,show submission or fear.,3.5
2236,2236.0,the public submission of a legal record,the entering of a legal document into the public record.,4.25
