,Unnamed: 0,sent_1,sent_2,score
0,0.0,The problem likely will mean corrective changes before the shuttle fleet starts flying again.,He said the problem needs to be corrected before the space shuttle fleet is cleared to fly again.,4.4
1,1.0,"The technology-laced Nasdaq Composite Index .IXIC inched down 1 point, or 0.11 percent, to 1,650.","The broad Standard & Poor's 500 Index .SPX inched up 3 points, or 0.32 percent, to 970.",0.8
2,2.0,"""It's a huge black eye,"" said publisher Arthur Ochs Sulzberger Jr., whose family has controlled the paper since 1896.","""It's a huge black eye,"" Arthur Sulzberger, the newspaper's publisher, said of the scandal.",3.6
3,3.0,"SEC Chairman William Donaldson said there is a ""building confidence out there that the cop is on the beat.""","""I think there's a building confidence that the cop is on the beat.""",3.4
4,4.0,Vivendi shares closed 1.9 percent at 15.80 euros in Paris after falling 3.6 percent on Monday.,"In New York, Vivendi shares were 1.4 percent down at $18.29.",1.4
5,5.0,"Myanmar's pro-democracy leader Aung San Suu Kyi will return home late Friday but will remain in detention after recovering from surgery at a Yangon hospital, her personal physician said.","Myanmar's pro-democracy leader Aung San Suu Kyi will be kept under house arrest following her release from a hospital where she underwent surgery, her personal physician said Friday.",4.6
6,6.0,"Darren Dopp, a Spitzer spokesman, declined to comment late Thursday.","John Heine, a spokesman for the commission in Washington, declined to comment on Mr. Spitzer's criticism.",1.4
7,7.0,Bremer said one initiative is to launch a US$70 million nationwide program in the next two weeks to clean up neighborhoods and build community projects.,"Bremer said he would launch a $70-million program in the next two weeks to clean up neighborhoods across Iraq and build community projects, but gave no details.",3.6
8,8.0,"In afternoon trading in Europe, France's CAC-40 advanced and Britain's FTSE 100 each gained 0.7 percent, while Germany's DAX index rose 0.6 percent.","In Europe, France's CAC-40 rose 1.3 percent, Britain's FTSE 100 declined 0.2 percent and Germany's DAX index gained 0.6 percent.",2.0
9,9.0,He later learned that the incident was caused by the Concorde's sonic boom.,He later found out the alarming incident had been caused by Concorde's powerful sonic boom.,5.0
10,10.0,Sens. John Kerry and Bob Graham declined invitations to speak.,The no-shows were Sens. John Kerry of Massachusetts and Bob Graham of Florida.,3.6
11,11.0,Page said it's also possible that genes on the Y chromosome may influence gender-specific differences in disease susceptibility.,He added that genes on the Y might play a role in influencing gender-specific differences in disease susceptibility.,4.4
12,12.0,One of the most well studied facets of temperament is how people respond to novelty.,One of the defining and well-studied characteristics of temperament is how people react to novelty.,4.8
13,13.0,"But butterflies exposed to an earlier light cycle, from 1am to 1pm, orientated themselves towards the south-east.","But butterflies housed under an earlier light cycle, 1 a.m. to 1 p.m., flew toward the southeast.",4.6
14,14.0,"RT Jones analyst Juli Niemann said Grant was ""the one we were all pulling for.","He has a very good reputation,"" RT Jones analyst Juli Niemann said of Grant.",1.4
15,15.0,"A key question was whether France, which infuriated Washington by leading the charge against U.N. authorization for the war, would vote ""Yes"" or abstain.","France, which infuriated Washington by leading the charge against U.N. approval for the war, also sought changes.",2.6
16,16.0,"Mel Gibson's passion-stirring Biblical epic ""The Passion of Christ"" will open in the United States on Feb. 25 - Ash Wednesday on the Roman Catholic calendar.","Mel Gibson is negotiating with Newmarket Films to distribute his embattled Biblical epic ""The Passion of Christ"" in the United States.",2.0
17,17.0,"Dunlap won both the swimsuit competition and the talent portion of the competition, singing ""If I Could.""","She won the talent portion singing ""If I Could"" and also won in evening wear.",2.8
18,18.0,Governor Gray Davis estimated yesterday that the fires could cost nearly $2 billion.,State officials estimated the cost at nearly $2 billion.,3.5
19,19.0,The American Express Corp. has pledged at least $3 million of more than $5 million needed.,"The city had requested federal funds, but withdrew that request when American Express pledged at least $3 million.",3.2
20,20.0,"South Asia follows, with 1.1 millions youths infected — 62 percent of them female.","Of the 1.1 million infected in south Asia, 62% are female.",4.0
21,21.0,"An hour later, an Israeli helicopter fired missiles at a car in Gaza City, killing two Hamas officials and at least five other people.","An hour later Israeli attack helicopters rained missiles on a car in Gaza City, killing seven people, Palestinian sources said.",4.25
22,22.0,Executive recruiters say that finding a seasoned chief merchandising officer will perhaps be the trickiest of all hires because there is such a dearth of good ones.,Executive recruiters say that finding a seasoned chief merchandising officer perhaps will be the trickiest of all hires.,3.75
23,23.0,"AAA spokesman Jerry Cheske said prices may have affected some plans, but cheap hotel deals mitigated the effect.","AAA spokesman Jerry Cheske said prices might have affected some plans, but cheap hotel deals made up for it.",5.0
24,24.0,"The decades-long conflict has killed more than 10,000 people in the resource-rich province, most of them civilians.","More than 10,000 people, most of them civilians, have been killed in three decades of insurgency.",4.0
25,25.0,"Claudette, the first hurricane of the Atlantic storm season, hit the mid-Texas coast July 15 with 85-mph wind.","Claudette, the first hurricane of the Atlantic storm season, hit the mid-Texas coast July 15, classified as a Category 1 hurricane with maximum sustained winds of 85 mph.",4.0
26,26.0,"She countersued for $125 million, saying Gruner & Jahr broke its contract with her by cutting her out of key editorial decisions.","She countersued for $125 million, saying G+J broke its contract with her by cutting her out of key editorial decisions and manipulated the magazine's financial figures.",3.5
27,27.0,"The Standard Edition is $15,000 per processor or $300 per named user.",The Standard Edition One is a single processor version of the Oracle Standard Edition Database.,2.5
28,28.0,Results from No. 2 U.S. soft drink maker PepsiCo Inc. (nyse: PEP - news - people) were likely to be in the spotlight.,Wall Street was also waiting for aluminum maker Alcoa Inc. (nyse: PEP - news - people) to report earnings after the close.,2.0
29,29.0,Microsoft acquired Virtual PC when it bought the assets of Connectix earlier this year.,"Microsoft acquired Virtual PC from its developer, Connectix, earlier this year.",4.4
30,30.0,"Taylor's aides warn an abrupt departure could trigger more chaos, a view shared by many in Liberia and, in private, even by mediators.","His aides warn an abrupt departure could trigger more bloodshed, a view shared by many in Liberia.",3.6
31,31.0,"But Odette is the first to form over the Caribbean Sea in December, the Center said.",It is the first named storm to develop in the Caribbean in December.,4.2
32,32.0,"Leon Williams' body was found inside his third-floor apartment at 196 Bay St., in Tompkinsville.","The dead man, Leon Williams, was found in his third-floor apartment.",3.4
33,33.0,It's the first such drill since the September 11 terrorist attacks on New York and Washington.,It is the nation's first large-scale counterterrorism exercise since the Sept. 11 terrorist attacks.,4.0
34,34.0,The AFL-CIO is waiting until October to decide if it will endorse a candidate.,The AFL-CIO announced Wednesday that it will decide in October whether to endorse a candidate before the primaries.,4.0
35,35.0,"Ursel Reisen confirmed it operated the coach, but gave no details other than to say the passengers were of mixed ages.","Ursel Reisen confirmed it had been operating the coach, but declined to give details of the passengers other than to say they were of mixed ages.",4.8
36,36.0,"A total of 17 cases have been confirmed in the southern city of Basra, the Organization said.",A total of 17 confirmed cases of cholera were reported yesterday by the World Health Organisation in the southern Iraqi city of Basra.,3.6
37,37.0,He was also expected to visit Yemen and Bahrain during his tour of the region.,"Khatami, who arrived in Beirut Monday, was also to visit Syria, Yemen and Bahrain.",3.4
38,38.0,"General Myers told reporters that ""at first blush, it doesn't look like any rules were broken"".","""At first blush, it doesn't look like any rules were broken,"" said Gen. Richard Myers, chairman of the Joint Chiefs of Staff.",3.6
39,39.0,"Proving that the Millville son's sacrifice would not go unsung, Mayor James Quinn ordered all city flags flown at half-mast for the next 30 days.","In Millville yesterday, Mayor James Quinn ordered all city flags flown at half-staff for the next 30 days.",3.4
40,40.0,"Tom Kasmer, a 14-year-old from Belmont, N.C., got a word that sounded like ""zistee"" during yesterday's competition.","The 14-year-old national spelling finalist who attends school in Belmont, N.C., got a word that sounded like ""zistee"" during competition Wednesday.",3.75
41,41.0,"Tom Kraynak, manager of operations and resources for the Canton, Ohio-based East Central Area Reliability Council, said that scenario is one among many that investigators are considering.","Tom Kraynak, manager of operations and resources for the Canton, Ohio-based East Central Area Reliability Council, said investigators are considering the scenario.",4.25
42,42.0,They found molecules that can only be produced when ozone breaks down cholesterol.,And all of the samples contained molecules that can only be produced when cholesterol interacts with ozone.,4.25
43,43.0,"It was developed with consultation from more than 300 leaders in academia, industry, government and the public.","The plan, called The NIH Roadmap, was developed over 14 months with help from more than 300 consultants in industry and academia.",3.25
44,44.0,It can store more than a gigabyte of information equivalent to around 12 hours of music in one cubic centimetre.,"And it can store more than a gigabyte of information - equivalent to 1,000 high quality images or around 12 hours of music - in just one cubic centimetre.",3.846
45,45.0,"Earlier this month, RIM had said it expected to report second-quarter earnings of between 7 cents and 11 cents a share.",Excluding legal fees and other charges it expected a loss of between 1 and 4 cents a share.,1.2
46,46.0,The budget analysis comes as negotiations between the City Council and the Bloomberg administration heat up.,Budget negotiations between the mayor and the City Council are entering high gear.,3.2
47,47.0,"Also at increased risk are those whose immune systems suppressed by medications or by diseases such as cancer, diabetes and AIDS.",Also at increased risk are those with suppressed immune systems due to illness or medicines.,4.0
48,48.0,Local police authorities are treating the explosion as a criminal matter and nothing has been ruled out.,Acting New Haven Police Chief Francisco Ortiz said police were treating the explosion as a criminal matter.,3.4
49,49.0,"""For me, the Lewinsky imbroglio seemed like just another vicious scandal manufactured by political opponents,"" according to extracts released yesterday.","""For me, the Lewinsky imbroglio seemed like just another vicious scandal manufactured by political opponents,"" Mrs Clinton writes.",3.2
50,50.0,"In 2001 and 2002, wire transfers from 4 of the company's 40 accounts totaled more than $3.2 billion, prosecutors said.","Wire transfers from four of the 40 accounts open at Beacon Hill totaled more than $3.2 billion from 2001 to 2002, Morgenthau said.",3.8
51,51.0,"Stony Brook University launched the study in 1996, after earlier studies indicated a possible connection between electromagnetic fields and cancer.","The State University at Stony Brook launched the study in 1996, after earlier studies indicated a possible connection.",3.2
52,52.0,"Earlier, they had defied a police order and cried ""Allahu Akbar"" (God is Greatest) as Bashir walked to his seat in the tightly guarded courtroom.","Earlier, Bashir's supporters had defied a police order and cried ""Allahu Akbar (God is Greatest)"" as he walked to his seat.",4.0
53,53.0,Metropolitan Ambulance spokesman James Howe said five people were taken to hospital and three were treated at the scene after yesterday's incident.,"Spokesman James Howe said five children aged between 4 and 17 were taken to hospital with neck and chest injuries, while three others were treated at the scene.",3.333
54,54.0,Chiron already has nearly 20 percent acceptances from PowderJect's shareholders.,Chiron has acceptances from holders of nearly 20 percent of PowderJect shares.,3.667
55,55.0,But it is clear that the Joint Intelligence Committee was not involved.,This report was cleared by the Joint Intelligence Committee.,2.0
56,56.0,"About 22% of twentysomethings are obese, which is roughly 30 pounds over a healthy weight.",About 31 percent of Americans are now obese — roughly 30 or more pounds over a healthy weight.,2.6
57,57.0,"Coupling, an American version of a hit British comedy, will get the valuable Thursday 9:30 p.m. time slot.","Coupling, an American version of a hit British comedy, will couple with Friends on Thursdays.",3.0
58,58.0,Shares of Coke closed New York Stock Exchange trading Thursday at $44.01.,"In morning trading on the New York Stock Exchange, Coca-Cola shares were down 34 cents at $43.67.",2.4
59,59.0,Her body was found several weeks later in the Green River.,"Aug. 15, 1982: Remains of Chapman, Hinds and Mills are found in the Green River.",2.6
60,60.0,"""I feel that people that are sending these messages are infringing on my rights and everyone else's rights to use their computers,"" said McKechnie.","The people who are sending these messages are infringing on my rights and everyone else's rights to use your computer,"" McKechnie said.",4.4
61,61.0,"""Fighting continued until midnight,"" western rebel commander Ousmane Coulibaly told Reuters by satellite phone on Sunday.","""They ransacked and burned the two villages completely,"" rebel commander Ousmane Coulibaly told Reuters by satellite phone from the bush.",2.8
62,62.0,The reading for both August and July is the best seen since the survey began in August 1997.,It is the highest reading since the index was created in August 1997.,3.0
63,63.0,"""Generally unwanted - and often pornographic or with fraudulent intent - spam is a nuisance and a distraction,"" Gates writes, warming us up for the punchline.","Generally unwanted—and often pornographic or with fraudulent intent —spam is a nuisance and a distraction,"" Gates writes.",4.2
64,64.0,"US Special Forces troops are training Colombian soldiers at military bases in the region to protect the pipeline, which transports crude from Colombia's second-biggest oil field.",U.S. Special Forces troops are training Colombian soldiers at military bases in the region to protect the pipeline.,3.2
65,65.0,The retailer said it came to the decision after hearing the opinions of customers and associates.,"The decision came after ""listening to our customers and associates,"" Melissa Berryhill, a spokeswoman for Wal-Mart, said.",3.2
66,66.0,"Lord Falconer hailed the changes as ""a new beginning as far as the courts, Crown Prosecution Service and police are concerned"".","""It's a new beginning as far as the courts, Crown Prosecution Service and police are concerned, making the criminal justice system work better.""",3.0
67,67.0,"We need a certifiable pay as you go budget by mid-July or schools wont open in September, Strayhorn said.","Texas lawmakers must close a $185.9 million budget gap by the middle of July or the schools wont open in September, Comptroller Carole Keeton Strayhorn said Thursday.",2.6
68,68.0,Shares of Hartford rose $2.88 to $46.50 in New York Stock Exchange composite trading.,"Shares of Hartford were up $2.28, or 5.2 percent, to $45.90 in midday trading.",2.5
69,69.0,The DVD-CCA then appealed to the state Supreme Court.,The DVD CCA appealed that decision to the U.S. Supreme Court.,4.5
70,70.0,"""We believe we are fully prepared to roll out the [touch-screen] machines for the 2004 presidential primary,"" said Gilles W. Burger, State Board of Elections chairman.","""We believe we are fully prepared to roll out the revised Diebold machines,"" said Gilles W. Burger, chairman of the Maryland State Board of Elections.",3.75
71,71.0,Country-music station KKCS has suspended two disc jockeys for playing songs by the Dixie Chicks in violation of a ban imposed after one group member criticized President George Bush.,"A radio station has suspended two disc jockeys for locking themselves in the studio and continuously playing Dixie Chicks songs, violating the station's two-month-old ban on the group's music.",3.25
72,72.0,"The technology-laced Nasdaq Composite Index <.IXIC> jumped 26 points, or 1.78 percent, to 1,516.","The broad Standard & Poor's 500 Index .SPX was up 8.79 points, or 0.96 percent, at 929.06.",0.8
73,73.0,Business Week's online edition reported on Friday that WorldCom and the SEC could announce a settlement as early as Monday.,"BusinessWeek Online has learned that the settlement could come as early as Monday, May 19.",3.2
74,74.0,"Sovereign's shares lost 74 cents, or 4.5%, to $15.68.","Sovereign shares closed on the New York Stock Exchange at $15.68, down 74 cents, or 4.5 percent.",4.0
75,75.0,"Aspen Technology's shares dropped 74 cents, or 23 percent, to close at $2.48 on the Nasdaq.","In afternoon trading, Aspen's shares were off 89 cents or more than 27 percent at $2.33 per share.",2.2
76,76.0,The new law requires libraries and schools to use filters or lose federal financing.,The 6-3 ruling reinstates a law that told libraries to install filters or surrender federal money.,2.8
77,77.0,"In addition, it offered the United States and Israel a way to work around Mr. Arafat.","When the prime minister's position was established in the spring, it offered the United States and Israel a way to work around Arafat.",3.6
78,78.0,"And yes, Marilyn Monroe is definitely part of the story, titled ""Arthur Miller, Elia Kazan and the Blacklist: None Without Sin.""","Note the subheading of this terrible parable in the ""American Masters"" series, ""Arthur Miller, Elia Kazan and the Blacklist: None Without Sin.""",2.6
79,79.0,"Gilroy police and FBI agents described Gehring as cooperative, but said Saturday that he had revealed nothing about what had happened to the children.","Saturday, officials in California described Gehring as cooperative — but said he has revealed nothing about what has happened to the children.",3.8
80,80.0,"Scribner's body was found floating in the city's Portage Bay, where he lived with his wife in a houseboat.","A kayaker found Dr. Scribner's body floating near the doctor's houseboat in Portage Bay, where he was eating lunch when his wife, Ethel, left for an appointment.",3.2
81,81.0,"After protesters rushed the stage and twice cut power to the microphone, Hedges drew the speech to an early close.","After protesters rushed the stage and twice cut power to the microphone, Hedges cut his speech short.",5.0
82,82.0,"A passer-by found Ben hiding along a dirt road in Spanish Fork Canyon about 7 p.m., with his hands still taped together but his feet free.","A passer-by found the boy hiding along a dirt road in Spanish Fork Canyon about 7 p.m. Thursday, with his feet free but his hands still taped.",4.0
83,83.0,"Analysts expected earnings of 27 cents a share on revenue of $17.7 billion, Thomson First Call says.","Hewlett-Packard is putting in for a second-quarter profit of $659 million, or 29 cents a share, on revenue of $18 billion.",1.2
84,84.0,"Doctors say one or both boys may die, and that some brain damage is possible if they survive.","Doctors said that one or both of the boys may die and that if they survive, some brain damage is possible.",5.0
85,85.0,Another was in serious condition at Northwest Medical Center in Springdale.,"At Northwest Medical Center of Washington County in Springdale, one child is in serious condition.",3.8
86,86.0,"""I started crying and yelling at him, 'What do you mean, what are you saying, why did you lie to me?'""","Gulping for air, I started crying and yelling at him, 'What do you mean?",3.8
87,87.0,"Sean Harrigan, president of the California Public Employees' Retirement System, also suggested paring down the NYSE's 27-member board, changing its composition and making it more accountable.","Sean Harrigan, president of the California Public Employees' Retirement System, also suggested paring the NYSE's 27-member board and allotting more seats to investors outside the securities industry.",3.4
88,88.0,"Also missing is Al Larsen, 31, of Fort Worth, Texas, who was in another vehicle swept off the turnpike.","The other victim recovered Tuesday morning was Al Larsen, 31, of Fort Worth, Texas.",2.2
89,89.0,British-based GlaxoSmithKline Plc said earlier this year it would cut off supplies to Canadian drugstores that ship to the United States.,"GlaxoSmithKline, the UK drugmaker, has said it would cut off supplies to Canadian stores shipping drugs to the US.",4.2
90,90.0,The festival kicked off yesterday one day after the Competition Commission delivered its final verdict to the Government on the proposed £4.1 billion merger.,"The Competition Commission delivered its verdict yesterday on the proposed merger of the two big ITV players, Carlton and Granada.",2.818
91,91.0,The Swedish central bank was also meeting on Wednesday and widely expected to announce a cut on Thursday.,"The Swedish central bank, also meeting on Wednesday, is widely expected to announce a cut on Thursday of as much as half a percentage point.",3.2
92,92.0,It was the third time in four years that wildfires forced the park to close.,"For the third time in four years wildfires closed Mesa Verde National Park, the country’s only park dedicated to ancient ruins.",3.0
93,93.0,"GM, the world's largest automaker, has 115,000 active UAW workers and another 340,000 retirees and spouses.","They cover more than 300,000 UAW workers and 500,000 retirees and spouses.",2.4
94,94.0,"His 1996 Chevrolet Tahoe was found abandoned in a Virginia Beach, Va., parking lot June 25.","His sport utility vehicle was found June 25, abandoned without its license plates in Virginia Beach, Va.",3.6
95,95.0,She said he persisted and she eventually allowed him to fix her bike while she sat in the front seat of his car.,"She said she eventually allowed him to fix her bike while she sat in his car, and they chatted.",3.875
96,96.0,Heatley was sixth in the league in goals last season with 41 and ninth in points with 89.,Heatley led Atlanta in scoring last season with a team-record 41 goals and 48 assists.,3.0
97,97.0,"Daniels said he doesn't know what Bush will have to say about him at tonight's $2,000-per-person presidential fund-raiser.","Daniels said he doesn't know what Bush will say at tonight's $2,000-per-person reception to raise funds for his presidential re-election bid.",4.4
98,98.0,"A three-judge panel of the 11th U.S. Circuit Court of Appeals ruled late Friday that the small size, limited use and secular purpose make the image legitimate.",A three-judge panel of the 8th U.S. Circuit Court of Appeals in St. Louis overturned a ruling issued last year that supported the ordinance.,2.8
99,99.0,"""Tony's not feeling well,"" Spurs coach Gregg Popovich said.","We're thrilled to be up 3-2,'' Coach Gregg Popovich said Wednesday.",1.6
100,100.0,Electronic Data Systems Corp. Thursday said the Securities and Exchange Commission has asked the company for documents related to its large contract with the U.S. Navy.,"In a regulatory filing, EDS said the SEC had asked for information related to its troubled IT outsourcing contract with the US Navy.",3.2
101,101.0,The company claims it's the largest single Apple VAR Xserve sale to date.,The company claimed it is the largest sale of Xserves by an Apple retailer.,5.0
102,102.0,Only 29 families of frogs are known and most were identified and described in the mid-1800s and the last in 1926.,"Only 29 families of frogs are known, most of which were named by the mid-1800s.",3.8
103,103.0,"Officials at Brandeis said this was an ""extremely heartrending"" time for the campus.","""This is an extremely heartrending time for the entire Brandeis University community.",4.4
104,104.0,North American markets finished mixed in directionless trading Monday as earnings season begins to slow and economic indicators move into the spotlight.,"North American markets grabbed early gains Monday morning, as earnings season begins to slow and economic indicators take the spotlight.",3.8
105,105.0,"As well as the dolphin scheme, the chaos has allowed foreign companies to engage in damaging logging and fishing operations without proper monitoring or export controls.",Internal chaos has allowed foreign companies to set up damaging commercial logging and fishing operations without proper monitoring or export controls.,3.8
106,106.0,"The value will total about $124 million, including convertible securities, according to Corel.","Including convertible securities, the total estimated value of the deal is $124 million, according to Corel.",5.0
