,Unnamed: 0,sent_1,sent_2,score
653,653.0,Mr McDevitt has been granted control of three crucial aspects of policing in the Solomons.,Mr McDevitt has been granted control of three aspects of policing by Commissioner William Morrell.,3.75
654,654.0,"Gold's rise pulled other precious metals higher, shunting silver to $4.81/83 an ounce from $4.77/79 last quoted in New York.","Gold's bounce pulled other precious metals higher, sending silver to $4.83/85 an ounce from $4.80/82 last quoted in New York.",3.25
655,655.0,Officials with North Carolina Speedway at Rockingham could not be reached.,NASCAR officials could not be reached for comment Tuesday.,2.909
656,656.0,They said the child was taken to Nassau County Medical Center for observation.,"The boy was taken to Nassau University Medical Center, where staff said he was ""doing okay.""",3.4
657,657.0,"Tisha Kresler, a spokeswoman for Global Crossing, declined to comment.",A Global Crossing representative had no immediate comment.,3.6
658,658.0,"Shares of LendingTree soared $5.99, or 40.1 percent, to $20.68 in afternoon trading on the Nasdaq Stock Market.","Shares of LendingTree rose $6.21, or 42 percent, to $20.90 after hitting $21.36 earlier.",2.2
659,659.0,The unions also staged a five-day strike in March that forced all but one of Yale's dining halls to close.,The unions also staged a five-day strike in March; strikes have preceded eight of the last 10 contracts.,2.6
660,660.0,"Gov. Rick Perry has said that while he opposes gambling expansion, he would be reluctant to veto continuation of the Lottery Commission.","Gov. Rick Perry opposes expansion of gambling but has said he would be ""hard-pressed"" to veto the lottery sunset bill.",3.8
661,661.0,"In midafternoon trading, the Nasdaq composite index was up 8.34, or 0.5 percent, to 1,790.47.","The Nasdaq Composite Index .IXIC dipped 8.59 points, or 0.48 percent, to 1,773.54.",1.6
662,662.0,"In Kentucky, Democratic Attorney General Ben Chandler faces U.S. Rep. Ernie Fletcher.","Kentucky: Republican Ernie Fletcher, a three-term House member, is battling Democratic state Attorney General Ben Chandler.",3.8
663,663.0,"The Dow Jones Industrial Average fell 98.32, or about 1.1 percent, to 9011.53.","The Dow Jones industrial average finished the day down 98.32 points at 9,011.53.",3.4
664,664.0,"Enron's 401(k) plan covered about 20,000 workers, retirees and beneficiaries.",Enron's stock comprised as much as 61% of the workers' 401(k) portfolios.,2.5
665,665.0,The US Senate judiciary committee overcame a significant hurdle yesterday in the battle to create a trust fund to pay victims of asbestos exposure.,The Senate judiciary committee on Tuesday overcame a significant hurdle in the battle to create a trust fund to pay victims of asbestos exposure but the most difficult obstacles remain.,3.75
666,666.0,But she didn't say whether she'll certify the two-year $117.4 billion budget for 2004-05.,She said she didn't know yet whether she would certify the budget.,3.167
667,667.0,It would be difficult to overestimate the potential dangers of the Remote Procedure Call (RPC) vulnerability.,"The flaw involves the Remote Procedure Call (RPC) protocol, which deals with inter-computer communications.",2.5
668,668.0,"Although obesity can increase the risk of health problems, skeptics argue, so do smoking and high cholesterol.","Although obesity can increase the risk of a host of health problems, skeptics argue, so do smoking and high cholesterol, which are not considered diseases.",4.25
669,669.0,Michelle Wie chips Sunday during her 1-up victory over Virada Nirapathpongporn in the 27th U.S. Women's Amateur Public Links Championship.,Now she has her first trophy after victory in the US Women's Amateur Public Links here on Sunday.,2.75
670,670.0,"Sony said the PSP would also feature a 4.5-inch LCD screen, Memory Stick expansion slots.",It also features a 4.5 in back-lit LCD screen and memory expansion facilities.,2.75
671,671.0,"At one of the three sampling sites at Huntington Beach, the bacteria reading came back at 160 on June 16 and at 120 on June 23.",The readings came back at 160 on June 16 and 120 at June 23 at one of three sampling sites at Huntington Beach.,3.25
672,672.0,The American conservatives are clearly in the minority within the Episcopal Church.,The letter indicates the Vatican's interest in bolstering conservatives within the Episcopal Church.,1.8
673,673.0,"Where long-lines used to catch 10 fish per 100 hooks in past decades, they are now lucky to catch one, the study found.","""Whereas long lines used to catch 10 fish per 100 hooks, now they are lucky to catch one,"" Myers said.",4.2
674,674.0,"The New York senator's new book, ""Living History,"" appears a certain bestseller.","Hillary Clinton, the New York senator and former first lady, has a book out Monday titled Living History.",3.2
675,675.0,"Carnival Corp. stock was trading at $31.29 during midday trading Wednesday, down 72 cents or 2.25 percent.","Carnival Corp. stock was down 2.5 percent, or 81 cents, at $31.20 on the New York Stock Exchange.",3.2
676,676.0,But Senate criticism of the House plan Tuesday came on several fronts.,And several Senate Republicans are cranky about the House map.,2.75
677,677.0,"As a result, Murphy sought to substitute Strier's sister, Ethel Celnik, as the trustee.","Murphy said Strier's sister, Ethel Celnik, was in the courtroom at the time, but Strier was not.",1.75
678,678.0,"It will cost about $20,000 per eight-week course of treatment, comparable to other injected cancer therapies, a spokeswoman said.","It will cost about $20,000 per average course of treatment -16 to 17 weeks.",3.5
679,679.0,"The rule bars groups from airing ads that promote, support, attack or oppose a candidate at any time.","It upheld fallback rules that bar the same groups from airing ads that promote, support, attack or oppose a candidate at any time.",3.75
680,680.0,Cisco pared spending to compensate for sluggish sales.,"In response to sluggish sales, Cisco pared spending.",4.8
681,681.0,"Kansas City drafted outfielder Chris Lubanski, from Kennedy-Kenrick High School in Pennsylvania, with the fifth pick.","The Royals chose Chris Lubanski, a high school outfielder from Pennsylvania who hit .528, with the fifth pick.",3.4
682,682.0,Sterling was down 0.8 percent against the dollar at $1.5875 GBP= .,The dollar rose 0.15 percent against the Japanese currency to 115.97 yen.,0.8
683,683.0,"The Dow Jones industrial average .DJI rose 41.61 points, or 0.44 percent, to 9,415.82.","The Dow Jones rose 41.61 points Friday, a gain of 0.4% for the day and 0.7% for the week.",4.0
684,684.0,"""Right from the beginning, we didn't want to see anyone take a cut in pay.","But Mr. Crosby told The Associated Press: ""Right from the beginning, we didn't want to see anyone take a cut in pay.",4.0
685,685.0,"""There were a number of bureaucratic and administrative missed signals -- there's not one person who's responsible here,"" Gehman said.","In turning down the NIMA offer, Gehman said, ''there were a number of bureaucratic and administrative missed signals here.",3.75
686,686.0,DeVries did make one stop in town Wednesday - registering as a sex offender at the Soledad Police Department.,Convicted child molester Brian DeVries spoke out in response to community outrage Wednesday afternoon after registering as a sex offender at the Soledad Police Department.,3.25
687,687.0,"At 5 p.m. EDT, Grace's center was near latitude 25.6 north, longitude 93.7 west or about 280 miles east-southeast of Corpus Christi.","At 11 a.m. EDT, Fabian's center was near latitude 18.1 north and longitude 53.2 west, or about 550 miles east of the Leewards.",1.25
688,688.0,"On Saturday, a 149mph serve against Agassi equalled Rusedski's world record.","On Saturday, Roddick equalled the world record with a 149 m.p.h. serve in beating Andre Agassi.",3.5
689,689.0,Teams of inspectors walked into a restricted area at one park without being stopped; others took pictures of sensitive areas without being challenged.,Teams of inspectors walked into a restricted area at one park without being stopped by employees; others took pictures of security-sensitive areas without anyone challenging them.,4.75
690,690.0,"The broader Standard & Poor's 500 Index .SPX climbed 10 points, or 1.10 percent, to 943.","The Nasdaq Composite Index .IXIC jumped 43.64 points, or 2.89 percent, to 1,553.73.",1.0
691,691.0,October heating oil futures settled .85 cent lower at 69.89 cents a gallon.,October heating oil ended down 0.41 cent to 70.74 cents a gallon.,2.5
692,692.0,Mr Levine confirmed that Ms Cohen Alon had tried to sell the story during the World Cup.,"Ms Cohen Alon's lawyer, Donald Levine, confirmed she tried to sell the story in February.",3.438
693,693.0,"Mr. Bankhead said the crime scenes indicated that the killer was ""very methodical.""",GBI spokesman John Bankhead said the murder scenes showed that the killer was very methodical.,4.0
694,694.0,"""This moves us a lot closer to saying that the foam can do this kind of damage,"" said Hubbard, a member of the Columbia Accident Investigation Board.","""I think this moves us a lot closer toward saying that foam can do this kind of damage,"" Hubbard said.",3.6
695,695.0,"""We had nothing to do with @Stake's internal personnel decision,"" Microsoft spokesman Sean Sundwell said.","""Microsoft had absolutely nothing to do with AtStake's internal personnel decision,"" Sundwall said.",4.2
696,696.0,"Egyptologists cast doubt Tuesday on an expedition's claim that it may have found the mummy of Queen Nefertiti, one of the best-known ancient Egyptians.","Egyptologists think they may have identified the long-sought mummy of Queen Nefertiti, one of the ancient world's legendary beauties.",2.6
697,697.0,"The identical rovers will act as robotic geologists, searching for evidence of past water.","The rovers act as robotic geologists, moving on six wheels.",3.2
698,698.0,Treasurys long-range plan is to provide retail buyers of all Treasury securities the ability to manage their holdings online in a single account.,The Treasury said wants to give retail buyers of all Treasury securities the ability eventually to manage holdings online in a single account.,4.4
699,699.0,"""Canada is a small country, and it needs companies like this, deals like this.""","A passionate nationalist, Mr. D'Alessandro said: ""Canada is a small country, and we need more companies like this.""",3.0
700,700.0,"He was listed last night in critical but stable condition at Kings County Hospital Center, police said.","That victim, a New Jersey resident, was in critical but stable condition at the hospital.",3.25
701,701.0,"The 30-year bond US30YT=RR grew 1-3/32 for a yield of 4.30 percent, down from 4.35 percent late Wednesday.","At 11 a.m. (1500 GMT), the 10-year note US10YT=RR was up 11/32 for a yield of 3.36 percent from 3.40 percent Wednesday.",2.0
702,702.0,Representatives for Puretunes could not immediately be reached for comment Wednesday.,Puretunes representatives could not be located Thursday to comment on the suit.,3.25
703,703.0,"IAC's stock closed yesterday down $2.81, or 7.6 percent, at $34.19.","InterActiveCorp's shares closed at $34.19, down $2.81, or 7.6 percent on the Nasdaq Stock Market.",4.5
704,704.0,"Byrd, speaking from the Senate floor, said he questioned ""the motives of a deskbound president who assumes the garb of a warrior for purposes of a speech.""","""But I do question the motives of a desk-bound president who assumes the garb of a warrior for the purposes of a speech.""",3.4
705,705.0,The Ministry of Defence is facing a 20m compensation claim from hundreds of Kenyan women who claim they were raped by British soldiers.,Hundreds of Kenyan women claiming they were attacked and raped by British soldiers were granted government legal aid Wednesday to pursue their case against the Ministry of Defense.,3.0
706,706.0,Police official S.K. Tonapi told Reuters at least 40 people had been killed and more than 100 wounded.,State interior ministry spokesman Vasant Pitke told Reuters that at least 42 people had been killed and 112 injured.,1.8
707,707.0,"Shares of USA Interactive rose $2.28, or 7 percent, to $34.96 on Friday in Nasdaq Stock Market composite trading and have gained 53 percent this year.","Shares of LendingTree rose $6.03, or 41 percent, to close at $20.72 on the Nasdaq stock market yesterday.",1.0
708,708.0,Similar bills passed the House twice but died in the Senate.,"Two years ago, the House passed a similar version that floundered in the Senate.",2.75
709,709.0,The show's closure affected third-quarter earnings per share by a penny.,The company said this impacted earnings by a penny a share.,3.25
710,710.0,"I've still got a fighting chance, though,"" Hewitt said after battling to overcome Davydenko 6-3 4-6 6-3 7-6 (7-5) on centre court.","""I'm still not red-hot favourite,"" Hewitt said after battling to down Davydenko 6-3 4-6 6-3 7-6 (7-5) on centre court.",3.75
711,711.0,"""Jeremy's a good guy,"" Barber said, adding: ""Jeremy is living the dream life of the New York athlete.","He also said Shockey is ""living the dream life of a New York athlete.",2.75
712,712.0,"The woman was hospitalized June 15, Kansas health officials said.",Missouri health officials said he had not been hospitalized and is recovering.,1.0
713,713.0,Blue chips edged lower by midday on Wednesday as a wave of profit warnings drained some of the optimism that has driven a rally over the past three months.,U.S. stocks fell in early morning trade on Wednesday as a wave of profit warnings drained some of the optimism that has driven a rally over the past three months.,3.6
714,714.0,"The technology-laced Nasdaq Composite Index <.IXIC> tacked on 5.91 points, or 0.29 percent, to 2,053.27.","The technology-focused Nasdaq Composite Index <.IXIC> advanced 6 points, or 0.30 percent, to 2,053, erasing earlier losses.",3.2
715,715.0,"But Mitsubishi Tokyo Financial (JP:8306: news, chart, profile) declined 3,000 yen, or 0.65 percent, to 456,000 yen.","Sumitomo Mitsui Financial (JP:8316: news, chart, profile) was down 2.5 percent at 198,000 yen.",1.6
716,716.0,"Two Kuwaitis and six Palestinians with Jordanian passports were among the suspects, the official said.","They include two Kuwaitis and six Palestinians with Jordanian passports, and the remainder are Iraqis and Saudis, the official said.",3.0
717,717.0,"Her birthday, 21 April, was declared a public holiday and she attended a reception and a ball.","When his grandmother, then-Princess Elizabeth, turned 21 in 1947, the day was declared a public holiday, and she attended a reception and a ball.",3.2
718,718.0,"Sorkin, who faces charges of conspiracy to obstruct justice and lying to a grand jury, was to have been tried separately.",Sorkin was to have been tried separately on charges of conspiracy and lying to a grand jury.,4.6
719,719.0,"The man, who entered the post office in Lakeside shortly before 3 p.m., gave up to deputies about 6:30 p.m.",The man had entered the post office on Woodside Avenue at Maine Avenue shortly before 3 p.m.,2.8
720,720.0,"""Fewer than 10"" FBI offices have conducted investigations involving visits to mosques, the Justice Department said.","In addition, the Justice Department said that the FBI has conducted ''fewer than 10'' investigations involving visits to mosques.",4.2
721,721.0,"Outside the court, Sriyanto, who faces up to 25 years' jail, denied he had done anything wrong.","Outside the court, Sriyanto denied to The Age that he had done anything wrong.",3.2
722,722.0,"University of Michigan President Mary Sue Coleman said in a statement on the university's Web site, ""Our fundamental values haven't changed.","""Our fundamental values haven't changed,"" Mary Sue Coleman, president of the university, said in a statement in Ann Arbor.",4.0
723,723.0,"Two astronomers surveying the region around Jupiter have detected 20 new moons, bringing the giant planet's total to 60.","Astronomers have clocked eight more moons orbiting Jupiter, bringing its known total to 60.",3.0
724,724.0,Comcast Class A shares were up 8 cents at $30.50 in morning trading on the Nasdaq Stock Market.,The stock rose 48 cents to $30 yesterday in Nasdaq Stock Market trading.,2.2
725,725.0,"Thomas was joined in full by Rehnquist, and in parts by O'Connor and Scalia.",He was joined by Chief Justice William H. Rehnquist and Justices Sandra Day O'Connor and Antonin Scalia.,2.8
726,726.0,"""What they have done is a thinly veiled attempt to do an end run around the Constitution,"" she said.","The church's lawyer, Shirley Phelps-Roper, was clear: ""What they have done is a thinly veiled attempt to do an end run around the constitution,"" she said.",2.6
727,727.0,"When you crossed the line, you violated the constitutional right,"" said Charles Weisselberg, a UC Berkeley law professor.","When you crossed the line, you violated the constitutional right,"" said Charles Weisselberg, who teaches law at the University of California, Berkeley.",5.0
728,728.0,"Preliminary reports were that the men were not seen together at the airport, sources said.","The men had Pakistani passports and reportedly were seen together at the airport earlier in the evening, law enforcement sources said.",2.0
729,729.0,Toronto yesterday had 64 probable cases of SARS and nine suspect cases.,"As of Wednesday, there were 65 probable SARS cases in the Toronto region.",3.25
730,730.0,"The Nasdaq composite index rose 13.70, or 0.8 per cent, to 1700.34.","The technology-laced Nasdaq Composite Index .IXIC gained 13.73 points, or 0.81 percent, to finish at 1,700.34.",3.75
731,731.0,"Toll, Australia's second-largest transport company, last week offered NZ75 a share for Tranz Rail.","Toll last week offered to buy the company for NZ75c a share, or $NZ158 million.",3.5
732,732.0,"About 1,557 genes on chromosome 6 are thought to be functional.","The remaining 1,557 genes are believed to be all functional.",2.75
733,733.0,"MessageLabs, which runs outsourced e-mail servers for 700,000 customers around the world, said it had filtered out 27,000 infected e-mails in 115 countries as of Thursday morning.","Messagelabs, which runs outsourced e-mail servers for 700,000 customers around the world, has labeled the worm ""high risk"" and reports more than 31,000 infections in 120 countries.",2.75
734,734.0,"In the second quarter, Anadarko now expects volume of 46 million BOE, down from 48 million BOE.",Production for the second quarter was cut to 46 million barrels from 48 million barrels.,3.25
735,735.0,"U.S. troops encountered no resistance during the five-hour sweep near Tikrit, Saddam Hussein's hometown and the center of a region of Baath Party supporters.",Tikrit is Saddam Hussein's hometown and the region around it is known as a hotbed of Baath Party supporters and former high-ranking Iraqi military officials.,2.25
736,736.0,"The woman felt threatened and went to the magistrate's office, police said.",The woman reported that she felt threatened and obtained a warrant for Stackhouse's arrest from the local magistrate's office.,3.25
737,737.0,"Miodrag Zivkovic, of the Liberal Alliance of Montenegro, won 31 percent of the vote while the independent Dragan Hajdukovic got four percent.","Miodrag Zivkovic, the leader of the pro-independence opposition Liberal Alliance, came in second with 31 percent of the vote.",3.0
738,738.0,Carlson on Tuesday said he would not recuse himself from the case.,Service officials said Carlson refused to recuse himself from the case.,4.0
739,739.0,"Oracle shares were also higher, trading up 12 cents at $13.60.",Shares of Redwood Shores-based Oracle rose 14 cents to $13.62.,2.0
740,740.0,"In the year-ago period, Pearson posted a 26 million pre-tax profit.",A year ago the firm posted a profit of 26 million pounds.,3.182
741,741.0,"With all precincts reporting, Fletcher — a three-term congressman from Lexington — had an overwhelming 57 percent of the vote.","With all precincts reporting, Fletcher had 88,747 votes, or 57 percent of the total.",3.0
742,742.0,"Through Thursday, Oracle said 34.75 million PeopleSoft shares had been tendered.","Some 34.7 million shares have been tendered, Oracle said in a statement.",3.75
743,743.0,"In Hong Kong, 24 patients were quarantined Wednesday after seven public hospital workers developed flu-like symptoms.",This after seven health care workers at a public hospital fell ill with flu-like symptoms.,3.0
744,744.0,"On the upside, Coca-Cola Co. (nyse: KO - news - people) reported higher profit for the quarter early on Thursday, helped by European demand.","Coca-Cola Co. (KO) reported higher profit for the quarter, helped by European demand, early on Thursday.",4.6
745,745.0,Yucaipa owned Dominick's before selling the chain to Safeway in 1998 for $2.5 billion.,Yucaipa bought Dominick's in 1995 for $693 million and sold it to Safeway for $1.8 billion in 1998.,2.6
746,746.0,"The unemployment rate rose a tenth of a percentage point to 6.1%, the highest level since July 1994.",The unemployment rate is predicted to have ticked up a percentage point to 6.1%.,3.2
747,747.0,"As part of his deal, Mr. Delainey has agreed to cooperate in the continuing investigation.",Dave Delainey agreed to cooperate with federal prosecutors in exchange for the plea.,4.4
748,748.0,"Graves reported from Albuquerque, Villafranca from Austin and Ratcliffe from Laredo.",Pete Slover reported from Laredo and Gromer Jeffers from Albuquerque.,1.25
749,749.0,"A 25 percent increase would raise undergraduate tuition to about $5,247 annually, including miscellaneous, campus-based fees.","The 25 percent hike takes annual UC undergraduate tuition to $4,794 and graduate fees to $5,019.",2.5
750,750.0,A man with a hard hat is dancing.,A man wearing a hard hat is dancing.,5.0
751,751.0,A plane is taking off.,An air plane is taking off.,5.0
752,752.0,A young child is riding a horse.,A child is riding a horse.,4.75
753,753.0,A man is feeding a mouse to a snake.,The man is feeding a mouse to the snake.,5.0
754,754.0,A man is playing a large flute.,A man is playing a flute.,3.8
755,755.0,A man is spreading shreded cheese on a pizza.,A man is spreading shredded cheese on an uncooked pizza.,3.8
756,756.0,Three men are playing chess.,Two men are playing chess.,2.6
757,757.0,A woman is playing the guitar.,A man is playing guitar.,2.4
758,758.0,A woman is playing the flute.,A man is playing a flute.,2.75
759,759.0,A man is playing the cello.,A man seated is playing the cello.,4.25
760,760.0,A woman is cutting an onion.,A man is cutting onions.,2.615
761,761.0,Some men are fighting.,Two men are fighting.,4.25
762,762.0,A man is smoking.,A man is skating.,0.5
763,763.0,The man is playing the piano.,The man is playing the guitar.,1.6
764,764.0,A man is playing on a guitar and singing.,A woman is playing an acoustic guitar and singing.,2.2
765,765.0,A man is erasing a chalk board.,The man is erasing the chalk board.,5.0
766,766.0,A person is throwing a cat on to the ceiling.,A person throws a cat on the ceiling.,5.0
767,767.0,The man hit the other man with a stick.,The man spanked the other man with a stick.,4.2
768,768.0,A woman picks up and holds a baby kangaroo.,A woman picks up and holds a baby kangaroo in her arms.,4.6
769,769.0,A man is playing a flute.,A man is playing a bamboo flute.,3.867
770,770.0,A person is folding a piece of paper.,Someone is folding a piece of paper.,4.667
771,771.0,A man is running on the road.,A panda dog is running on the road.,1.6669999999999998
772,772.0,A dog is trying to get bacon off his back.,A dog is trying to eat the bacon on its back.,3.75
773,773.0,A woman is carrying a boy.,A woman is carrying her baby.,2.333
774,774.0,A girl is styling her hair.,A girl is brushing her hair.,2.5
775,775.0,The polar bear is sliding on the snow.,A polar bear is sliding across the snow.,5.0
776,776.0,A woman is writing.,A woman is swimming.,0.5
777,777.0,Three men are playing guitars.,Three men are on stage playing guitars.,3.75
778,778.0,A cat is rubbing against baby's face.,A cat is rubbing against a baby.,3.8
779,779.0,The man is riding a horse.,A man is riding on a horse.,5.0
780,780.0,A man pours oil into a pot.,A man pours wine in a pot.,3.2
781,781.0,A man is playing a guitar.,A girl is playing a guitar.,2.8
782,782.0,A panda is sliding down a slide.,A panda slides down a slide.,4.6
783,783.0,A group of men play soccer on the beach.,A group of boys are playing soccer on the beach.,3.6
784,784.0,A woman is eating something.,A woman is eating meat.,3.0
785,785.0,A woman peels a potato.,A woman is peeling a potato.,5.0
786,786.0,A woman peels a potato.,A woman is peeling a potato.,5.0
787,787.0,People are playing cricket.,Men are playing cricket.,3.2
788,788.0,The boy fell off his bike.,A boy falls off his bike.,4.8
789,789.0,A man is playing a guitar.,A man is playing a flute.,1.5830000000000002
790,790.0,The woman is playing the flute.,A woman is playing a flute.,5.0
791,791.0,The cougar is chasing the bear.,A cougar is chasing a bear.,5.0
792,792.0,A rabbit is running from an eagle.,A hare is running from a eagle.,4.2
793,793.0,The man cut down a tree with an axe.,A man chops down a tree with an axe.,5.0
794,794.0,The woman is frying a breaded pork chop.,A woman is cooking a breaded pork chop.,4.2
795,795.0,One woman is measuring another woman's ankle.,A woman measures another woman's ankle.,5.0
796,796.0,A girl is flying a kite.,A girl running is flying a kite.,4.0
797,797.0,A man is riding a mechanical bull.,A man rode a mechanical bull.,4.0
798,798.0,The man is playing the guitar.,A man is playing a guitar.,4.909
799,799.0,The man is playing the guitar.,A man is playing a guitar.,4.909
800,800.0,A woman is dancing and singing with other women.,A woman is dancing and singing in the rain.,3.0
801,801.0,A man is finding something.,A woman is slicing something.,0.8
