,Unnamed: 0,sent_1,sent_2,score
3163,,"this frame contains items which, when manipulated, alter the funtion of some device, internal or external.",a mechanism that controls the operation of a machine;,1.6
3164,,this frame describes a general situation in which an owner either increases or decreases their amount of a possession. the increase or decrease may either be physical or metaphorical.,"fail to keep or to maintain; cease to have, either physically or in an abstract sense;",1.8
3165,,an entity is integrated into a vehicle as a part of a (possibly unexpressed) whole which may refer to the whole vehicle or merely to a sub-part of the vehicle.,a transparent opening in a vehicle that allow vision out of the sides or back; usually is capable of being opened,1.4
3166,,this frame contains words that describe specific aspects of a color. the degree to which the color being discussed deviates from the prototype may be marked. the description may also target a specific aspect of color.,(used of color) having a dark hue;,1.2
3167,,a record that contains a permanent account of data. this record may be maintained by a recorder for a certain entity.,a record in which commercial accounts are recorded;,2.8
3168,,"this frame covers words for body_part(s) (bp) belonging to a possessor (poss), which may be characterized by a descriptor (desc). the location of the bp may be identified in terms of its attachment or its orientational_location. a subregion of a bp may also be indicated.",the front of the human head from the forehead to the chin and ear to ear;,1
3169,,"an agent performs a response action in consequence of a trigger event. in many cases, a non-agentive responding_entity causes the response after the trigger occurs.","contend against an opponent in a sport, game, or battle;",0
3170,,"a protagonist is in the dynamic, maintained state of being alive or has exited this state.",the condition of living or the state of being alive;,2.6
3171,,"an agent acts so as to be the strongest force, or most important causal factor in some situation, to the exclusion of other competing actors.","be larger in number, quantity, power, status or importance;",2.4
3172,,"an entity aids in the successful completion of a purpose. its degree of utility may also be expressed. some of the lexical units in this frame (e.g. great, good) can only express permanent, generic states of the entity.",of good quality and condition; solidly built;,1.2
3173,,"an agent causes an impactor to make sudden, forcible contact with an impactee, or manipulates two (or more) impactors so that they make mutual forcible contact.",drive something violently into a location;,0.8
3174,,an experiencer senses different degrees of warmth that may or may not be related to the ambient temperature. the level of warmth is usually compared against the experiencer's subjective standard of comfort.,having or producing a comfortable and agreeable degree of heat or imparting or maintaining heat;,1.2
3175,,"a protagonist is in the dynamic, maintained state of being alive or has exited this state.","have life, be alive;",1.4
3176,,a prisoner is punished for committing a crime by being confined to a prison for a specified period of time.,spend time in prison or in a labor camp;,2
3177,,"in this frame a speaker asks an addressee for something, or to carry out some action.",give instructions to or direct somebody to do something with authority;,2.6
3178,,"the temperature in a certain environment, determined by time and place, is specified.",having or producing a comfortable and agreeable degree of heat or imparting or maintaining heat;,1
3179,,"a state_of_affairs is evaluated as good (or bad), against a background assumption that previously, the state_of_affairs was thought to be unlikely to occur. the state_of_affairs holds for a particular protagonist.",deserving or inciting pity;,0
3180,,an agent makes use of a means (either an action or a (system of) entities standing in for the action) in order to achieve a purpose. (this frame may be broadened to include non-agentive intermediate actions.),how a result is obtained or an end is achieved;,2.2
3181,,"an developer develops a product, in some cases for a company.",act of improving by expanding or enlarging or refining;,0.4
3182,,"a text is an entity that contains linguistic, symbolic information on a topic, created by an author at the time_of_creation. it may be a physical entity that is made of a certain material etc. it may be constructed for an honoree.",a record or narrative description of past events;,0.8
3183,,"an influencing_variable, an influencing_situation, or an influencing_entity has an influence on a dependent_entity, dependent_variable, or a dependent_situation.  compare to subjective_influence. words in objective_influence are used to make claims about correlations in the world, where words in subjective_influence are used to explain emotional impacts made on cognizers.",the effect of one thing (or person) on another;,2.4
3184,,an entity is able to exert a force of the magnitude specified by the target.,having little impact;,0.2
3185,,"this frame is concerned with transparent nouns denoting a piece of a substance. also present is piece_prop which is a property of the piece, e.g. relating to its size.",a printed circuit that can be inserted into expansion slots in a computer to increase the computer's capabilities,0
3186,,"a speaker addresses an audience on a particular topic. the audience is generally passive, although for many types of address (including academic talks and press conferences), a discussion or question-answer period is virtually always required.",narrate or give a detailed account of;,1.6
3187,,the word(s) in this frame detail a particular moment in time.these often occur with demonstratives such as this and that.,the specified day of the month;,0.8
3188,,"this frame is concerned with nouns denoting a part or parts of a whole entity . the part is not defined relative to the whole's orientation, center, or edge and is not ordered. we also annotate properties of the part, e.g. relating to its size.",(music) the section of a composition or movement (especially in sonata form) where the major musical themes are developed and elaborated,0
3189,,an entity is designed for or exists to perform an activity or fulfill a role.,"serve a purpose, role, or function;",2.2
3190,,a place defined by an owner.,the land on which real estate is located;,2
3191,,"a law regulates activities or states of affairs within a jurisdiction, dictating what required states should be the case and what forbidden states should not. often it also indicates negative consequences for individuals that violate it, and these negative consequences are generally enforced by some official authority. they may or may not be created by some official legislative body.",a body of rules followed by an assembly,2.2
3192,,the authorities put a prisoner in prison as punishment for an offense.,the period of time a prisoner is imprisoned;,1.6
3193,,"ambient conditions of temperature, precipitation, windiness, and sunniness pertain at a certain place and time. further specification of the conditions that pertain may also be indicated.",free of clouds or rain;,1
3194,,"an individual or group (practitioner) or a part of their work life (work) is defined professionally by the activity that they typically engage in. alternatively, the activity may be indicated by a salient_entity conventionally associated with it.",the discipline that records and interprets past events involving human beings;,1.2
3195,,a particular piece of information is evaluated for its accuracy. the degree of correctness may also be expressed. the source of information may also metonymically stand in for the information.,consistent with fact or reality; not false;,1.6
3196,,"this frame contains adjectives and nouns that describe the truth or sincerity of communication. these words, analogously to behaver-evaluating words, can apply either to speakers or to the messages they produce. they can occur with about-pps expressing topic.",worthy of being depended on;,0
3197,,"this frame is for objects, physical or otherwise, which are used to grant access to some location or function.",a sequence of numbers or letters that opens a combination lock;,0.8
3198,,an entity has the ability to contain a theme.,be used by; as of a utility;,0
3199,,"this frame contains words that denote kinship relations. in annotating the directional uses of these words, we use the standard terms from anthropology, ego and alter. matilde is gilberto's cousin once removed",family based on male descent;,0.8
3200,,"two individuals, the subordinate and the superior have a relationship such that the subordinate generally follows orders given by the superior and has the best interests of the superior in mind.",work for or be a servant to;,2
3201,,lus in this frame denote a period of time in which an enabled_action becomes possible. the duration of this time period can be both exact and inexact. an agent who performs the enabled_action may be mentioned as well.,the time period that is considered best for starting or finishing something;,2.4
3202,,this frame is concerned with words that describe a person based on a salient part of their body.,(used of hair or skin) pale or light-colored; ;,0.4
3203,,"in this frame, there is a part of a whole in which the part is defined with respect to the canonical or inherent orientation of the whole. in cases where the target is an adjective, it has a special relationship with the noun that it modifies such that a phrase which is a syntactic argument of the noun is semantically available to fill the argument structure of the adjective, as in",the striking or working surface of an implement,0
3204,,an event takes place at a place and time.,a recent event that has some relevance for the present situation;,1
3205,,"there is a certain physical distance within which some other entity can participate in an event (typically perception or manipulation) with the participant. alternatively, the event may be indicated metonymically by a instrument . [note the connection with *distance, sufficiency, and capability. words in this frame can generally be paraphrased ""close enough to be able to"".]",a range of mental vision;,0
3206,,in this frame a part is part of a larger whole comprised of parts that are ordered. the parts can be ordered temporally (first to last and vice versa) or vertically (down to up and vice versa). the part can be modified by the part_prop or the number of the part can be given by ordinality.,a major division of a long written composition;,0.8
3207,,a competitor claims a prize as a result of the outcome of their participation in a competition.,be the winner in a contest or competition; be victorious;,2.2
3208,,an entity is able to exert a force of the magnitude specified by the target.,having strength or power greater than average or expected;,1.4
3209,,"an artifact is deliberately made or modified by an intelligent entity to be put to a certain kind of use. various properties of the artifact may be specified, such as its creator, time_of_creation, name, type, and the material of which it is composed. the artifact may or may not be a physical entity.",a stout length of sawn timber; made in a wide variety of sizes and used for many purposes,0.2
3210,,a helper benefits a benefited_party by enabling the culmination of a goal that the benefited_party has. a focal_entity that is involved in reaching the goal may stand in for it.,give help or assistance; be of service;,1.5
3211,,"a speaker realizes a sign, usually a linguistic one, in some formal_realization. the formal_realization may be described as correct or incorrect in a judgment expression, or it may be partially indicated as a part_of_form. manner may be used as a more general indication of the formal_realization","speak, pronounce, or utter in a certain way;",0.6
3212,,"this frame covers words that name locations as defined politically, or administratively.",the territory occupied by a nation;,3.4
3213,,"the support, a phenomenon or fact, lends support to a claim or proposed course of action, the proposition, where the domain_of_relevance may also be expressed. some of the words in this frame (e.g. argue) are communication words used in a non-communicative, epistemic sense.","establish the validity of something, as by an example, explanation or experiment;",1.6
3214,,the authorities put a prisoner in prison as punishment for an offense.,a prison term lasting as long as the prisoner lives;,1
3215,,an agent manipulates an instrument in order to achieve a purpose.,put into service; make work or employ for a particular purpose or for its inherent or natural purpose;,1.4
3216,,this frame concerns a cognizer's certainty about the correctness of beliefs or expectations. it only includes uses where a cognizer is expressed.,be aware of the truth of something; have a belief or faith in something; regard as true beyond any doubt;,1.8
3217,,"the words in this frame describe situations in which an agent or a cause injures a victim. the body_part of the victim which is most directly affected may also be mentioned in the place of the victim. in such cases, the victim is often indicated as a genitive modifier of the body_part, in which case the victim fe is indicated on a second fe layer.","deliver a sharp blow, as with the hand, fist, or weapon;",0.8
3218,,"a useful_location is accessible to some (possibly generic) theme despite a potential barrier, or is not accessible because of the barrier.",having skin rich in melanin pigments;,0
3219,,"in a text, a source_of_information is given that provides a reader of the text with further information relevant to the text. in this frame the author and reader are completely deprofiled, with the source_of_information made salient.",seek information from;,1.6
3220,,"a speaker interprets a written text and speaks the contents, usually to an addressee. the contents may be the text verbatim or a representation of the text.","look at, interpret, and say out loud something that is written or printed;",3.4
3221,,"words in this frame have to do with a cognizer being aware (or not being aware) of the difference between two phenomena, which may be expressed jointly or disjointly.","be able to distinguish, recognize as being different;",2
3222,,"the support, a phenomenon or fact, lends support to a claim or proposed course of action, the proposition, where the domain_of_relevance may also be expressed. some of the words in this frame (e.g. argue) are communication words used in a non-communicative, epistemic sense.",imply as a possibility;,0.8
3223,,"this frame describes intentionally formed human social groups (here termed organizations) with some definite structure and members. they may be relatively informal, consisting only of a group of individuals who are aware of who is and who is not a fellow member, or they may be complex and long-lasting, such as the roman catholic church or the conservative party.",a formal association of people with similar interests;,2.25
3224,,in this frame an evaluee is described by a (usually implicit) judge with respect to the morality or rightness of his or her behavior.,stemming from evil characteristics or forces; wicked or dishonorable; -Thomas Hardy,0.6
3225,,"an author creates a text, either written, such as a letter, or spoken, such as a speech, that contains meaningful linguistic tokens, and may have a particular addressee in mind. the text may include information about its topic, although the latter is not an fe in this frame.",recite or repeat a fixed text;,1.33333333333333
3226,,"a controlling_entity, controlling_situation, or controlling_variable control a dependent_entity, dependent_situation, or dependent_variable. the latter, dependent, element or some aspect of it is not just influenced, but determined by the controlling element.",power to direct or determine;,2.6
3227,,this frame describes a situation in which an owner loses his or her possession. the owner may have failed to keep ownership of their possession (i.e. robbery or gambling) or may have unintentionally misplaced their possession.,"fail to keep or to maintain; cease to have, either physically or in an abstract sense;",2.2
3228,,"these adjectives describe the degree of strictness or tolerance of an agent, usually with regard to another person (the controllee) and often with regard to a particular issue. the strictness/lenience with respect to the issue may be manifested in (expressed by) an agent or by some medium (e.g., laws), or by some behavior of the agent, i.e., the controlling_act.",unsparing and uncompromising in discipline or judgment;,1.6
3229,,some stimulus causes a cognizer to think of a prior phenomenon due to its perceived similarity.,suggest the necessity of an intervention; in medicine;,0
3230,,"an artifact is deliberately made or modified by an intelligent entity to be put to a certain kind of use. various properties of the artifact may be specified, such as its creator, time_of_creation, name, type, and the material of which it is composed. the artifact may or may not be a physical entity.",a flat portable surface (usually rectangular) designed for board games;,0
3231,,"authorities charge a suspect, who is under suspicion of having committed a crime (the charges), and take him/her into custody.the police arrested harry on charges of manslaughter.",record a charge in a police register;,0.8
3232,,the reader attends to a text to process its information. sometimes a particular kind of phenomenon is sought in the text.,interpret something that is written or printed;,1.8
3233,,this frame contains nouns denoting a rank or level within an established hierarchy.,(usually plural) the status or rank or office of a Christian clergyman in an ecclesiastical hierarchy;,1.6
3234,,"a text is an entity that contains linguistic, symbolic information on a topic, created by an author at the time_of_creation. it may be a physical entity that is made of a certain material etc. it may be constructed for an honoree.",a written work or composition that has been published (printed on pages bound together);,3
3235,,an insulator is judged for its potential to increase the body temperature of an experiencer. the activity that the experiencer engages in to experience the heat and the circumstances in which the insulator is judged may also be provided.,having or producing a comfortable and agreeable degree of heat or imparting or maintaining heat;,1.4
3236,,"an entity exists at a particular location, at a particular time, as observed by an implicit observer. a depictive and/or duration phrase is often found. this frame differs from existence in that the location is profiled as a ground where an observer is conceived of as confirming the entity's existence.     in some cases, the location may be recoverable from phrases that primarily express peripheral information",the state of being absent;,0.4
3237,,an entity undergoes some change (the event) that is (or is construed as) punctual. (this frame exists mainly to allow common fes to be inherited.),"affect or afflict suddenly, usually adversely;",0.6
3238,,"the locale is a geographical location as defined by shape. this frame includes natural geographic features, including land/ice forms and bodies of water.",a narrow channel of the sea joining two larger bodies of water,0.8
3239,,an entity is judged to be sensually pleasing or intellectually interesting to a (generally implicit) judge.,very pleasing to the eye;,3.2
3240,,"the words in this frame describe a period of time, as opposed to a point in time.",an indefinite period (usually marked by specific attributes or activities);,2
3241,,"an agent or entity becomes sufficient enough to meet a standard. alternatively, an action or occurrence can be thought of as event that fulfills a standard. in this frame, the agent, entity, or event can be conceptualized as being on a scale where a change of value or circumstances brings it in line with the position of the standard on the scale.",fill or meet a want or need,1.2
3242,,an entity stands out perceptually in comparison to other members of its type.,characterized by an absence or near absence of agitation or activity;,0.4
3243,,"the answer to one open question, the outcome, is dictated (partially or completely) by the answer to another open question, the determinant, i.e. if the answer to the determinant is known, the answer to the outcome can be predicted. the degree of predictive power and the circumstances under which the dependency holds can also be expressed.",a relation such that one thing is dependent on another;,2.4
3244,,this frame describes the attributes of a thermodynamic phase of matter.,(chemistry) the three traditional states of matter are solids (fixed shape and volume) and liquids (fixed volume and shaped by the container) and gases (filling the container);,1.2
3245,,"these words describe the size of message that a speaker is judged by a (usually unexpressed) judge to give, either in a specific occasion or topic or in general. as in other communication frames, medium may also be expressed.",free of noise or uproar; or making little if any sound;,1
3246,,"an entity is presented as having been seen or experienced by a (typically generic and backgrounded) cognizer on a certain number of occasions, causing the entity to have a certain degree of recognizability for the cognizer.",be familiar or acquainted with a person or an object;,2.6
3247,,"words in this frame describe the status of an action with respect to a code of laws or rules. an object may also be in violation or compliance of the code by virtue of its existence, location or possession.",(of a baseball) hit between the foul lines;,0.2
3248,,"these words refer to parts merging to form a whole. (the parts may also be encoded as part_1 and part_2.) there is a symmetrical relationship between the components that undergo the process, and afterwards the parts are consumed and are no longer distinct entities that are easily discernable or separable in the whole.",a collection of things that have been combined; an assemblage of separate parts or qualities,3
3249,,"a man-made artifact, digital or physical, which is used to display information presented via the object.",a vertical surface on which information can be displayed to public view,2
3250,,"words in this frame have to do with a cognizer believing that some phenomenon will take place in the future. some words in the frame (e.g. foresee.v) indicate that the phenomenon is asserted also to be true, while others do not.",look forward to the probable occurrence of;,2.2
3251,,a helper benefits a benefited_party by enabling the culmination of a goal that the benefited_party has. a focal_entity that is involved in reaching the goal may stand in for it.,help to some food; help with food or drink;,2
3252,,an entity is integrated into a building as a part of a (possibly unexpressed) whole which may refer to the whole building or merely to a sub-part of the building.,a pane of glass in a window;,0.6
3253,,the words in this frame refer to facial expressions and the possessors of those expressions.,the feelings expressed on a person's face;,3.4
3254,,geography as defined by its use.,a district that has been developed to serve some purpose;,2.4
3255,,"a phenomenon is portrayed with respect to the degree of likelihood that it will be perceived and known, given the (usually implicit) evidence, perceiver, and the circumstances in which it is considered. for several of the lus, such as visible, audible, etc., the type of the evidence is fixed by the targets themselves being a perceptual experience.",be or become visible or noticeable;,3.2
3256,,this frame concerns a specific subset of instances of a type which are evaluated in terms of their similarity to a conceptual prototype of the type. the judgment of exemplariness may be made along a certain domain.,devoted (sometimes fanatically) to a cause or concept or truth;,0
3257,,an entity can bear a great outer force so as to resist destruction and damage.,immune to attack; incapable of being tampered with;,2.2
3258,,lus in this frame modify a gradable attribute and describe intensities at the extreme positions on a scale.,surpassing what is common or usual or expected;,0.8
3259,,an authority with the power to make decisions hands down a finding over a question presented in a formal or informal case.,decide with authority;,2.8
3260,,"this frame covers words that name locations as defined politically, or administratively.",the territory occupied by one of the constituent administrative districts of a nation;,3.2
3261,,a speaker characterizes the intensity of an attribute of an entity by a degree.,intensely or extremely bad or unpleasant in degree or quality;,1.8
3262,,"an agent expends effort towards achieving a goal. alternatively, a salient_entity involved in the goal can be expressed in place of a goal expression.",activity directed toward making or doing something;,1.2
3263,,this frame has to do with scientific taxonomy. the lexical units in this frame include the seven major classifications in which organisms are grouped based on common biological characteristics. these classifications are labeled rank in this frame. the members or subtype of the rank is often expressed with the use of the target-denoting noun.,(biology) taxonomic group containing one or more families,2.8
3264,,this frame contains words referring to items of food.,a particular day specified as the time something happens;,0
3265,,"a person or institution is being described in terms of their wealthiness, in other words the amount of money in their possession.",having little money or few possessions;,0.8
